{
  "schema_version": "1.0.0",
  "decision_id": "linkage_spot_001",
  "entity_version": 1,
  "tenant_id": "tenant_demo",
  "portfolio_id": "portfolio_london",
  "correlation_id": "corr_ts3_spot_001",
  "content_hash": "sha256:8888888888888888888888888888888888888888888888888888888888888888",
  "created_at": "2026-07-31T09:30:05Z",
  "actor": {
    "identity_type": "SYSTEM",
    "actor_id": "linkage_resolver"
  },
  "source_observation_id": "obs_execution_spot_001",
  "deterministic_rule_version": "1.0.0",
  "decision": "ACCEPTED",
  "candidate_links": [
    {
      "trade_id": "trade_spot_001",
      "tenant_id": "tenant_demo",
      "portfolio_id": "portfolio_london",
      "match_key": "trade_spot_001",
      "match_rule_version": "1.0.0",
      "evidence_hash": "sha256:1111111111111111111111111111111111111111111111111111111111111111"
    }
  ],
  "chosen_trade_id": "trade_spot_001",
  "reason_code": "EXACT_DETERMINISTIC_KEY"
}
